[
  {
    "workbook_row_key": "country-london-paris:CO-02-1",
    "product_code_normalized": "CO-02-1",
    "canonical_name": "Шкаф для одежды 2-дв.",
    "collection_name_normalized": "country-london-paris",
    "category_normalized": "wardrobe",
    "price_normalized": 84600.0,
    "dimensions_normalized": {
      "height_mm": 2200,
      "width_mm": 1200,
      "depth_mm": 640
    },
    "medusa_product_handle": "co-02-1",
    "medusa_product_title": "Шкаф для одежды 2-дв.",
    "medusa_collection_handle": "country-london-paris",
    "medusa_collection_title": "Country London Paris",
    "medusa_category_handle": "shkafy",
    "medusa_category_title": "Шкафы",
    "medusa_product_type": "CONFIGURABLE",
    "medusa_variant_sku": "CO-02-1",
    "medusa_price_amount": 8460000,
    "variant_strategy": "single_default",
    "asset_binding_ref": "country-london-paris:CO-02-1",
    "upload_manifest_refs": [
      "products/country-london-paris/CO-02-1_gallery_01.jpg",
      "products/country-london-paris/CO-02-1_gallery_02.jpg",
      "products/country-london-paris/CO-02-1_gallery_03.jpg",
      "products/country-london-paris/CO-02-1_color_blue_01.jpg",
      "products/country-london-paris/CO-02-1_color_blue_02.jpg",
      "products/country-london-paris/CO-02-1_color_grey_01.jpg",
      "products/country-london-paris/CO-02-1_color_grey_02.jpg",
      "products/country-london-paris/CO-02-1_color_olive_01.jpg",
      "products/country-london-paris/CO-02-1_color_olive_02.jpg"
    ],
    "main_image_storage_key": "products/country-london-paris/CO-02-1_gallery_01.jpg",
    "gallery_storage_keys": [
      "products/country-london-paris/CO-02-1_gallery_02.jpg",
      "products/country-london-paris/CO-02-1_gallery_03.jpg"
    ],
    "asset_quality_status": "gallery_only",
    "readiness_status": "seed_ready_with_caveat",
    "mapping_notes": "No dedicated main image, first gallery used as main",
    "excluded_reason": null,
    "blocked_reason": null,
    "needs_business_decision": false
  },
  {
    "workbook_row_key": "country-london-paris:CO-05-1",
    "product_code_normalized": "CO-05-1",
    "canonical_name": "Комод",
    "collection_name_normalized": "country-london-paris",
    "category_normalized": "dresser",
    "price_normalized": 39200.0,
    "dimensions_normalized": {
      "height_mm": 810,
      "width_mm": 900,
      "depth_mm": 560
    },
    "medusa_product_handle": "co-05-1",
    "medusa_product_title": "Комод",
    "medusa_collection_handle": "country-london-paris",
    "medusa_collection_title": "Country London Paris",
    "medusa_category_handle": "komody",
    "medusa_category_title": "Комоды",
    "medusa_product_type": "CONFIGURABLE",
    "medusa_variant_sku": "CO-05-1",
    "medusa_price_amount": 3920000,
    "variant_strategy": "single_default",
    "asset_binding_ref": "country-london-paris:CO-05-1",
    "upload_manifest_refs": [
      "products/country-london-paris/CO-05-1_main.jpg",
      "products/country-london-paris/CO-05-1_gallery_01.jpg",
      "products/country-london-paris/CO-05-1_color_blue_01.jpg",
      "products/country-london-paris/CO-05-1_color_blue_02.jpg",
      "products/country-london-paris/CO-05-1_color_grey_01.jpg",
      "products/country-london-paris/CO-05-1_color_grey_02.jpg",
      "products/country-london-paris/CO-05-1_color_olive_01.jpg",
      "products/country-london-paris/CO-05-1_color_olive_02.jpg"
    ],
    "main_image_storage_key": "products/country-london-paris/CO-05-1_main.jpg",
    "gallery_storage_keys": [
      "products/country-london-paris/CO-05-1_gallery_01.jpg"
    ],
    "asset_quality_status": "ok",
    "readiness_status": "seed_ready",
    "mapping_notes": "",
    "excluded_reason": null,
    "blocked_reason": null,
    "needs_business_decision": false
  },
  {
    "workbook_row_key": "country-london-paris:CO-08-1",
    "product_code_normalized": "CO-08-1",
    "canonical_name": "Тумбочка прикроватная",
    "collection_name_normalized": "country-london-paris",
    "category_normalized": "nightstand",
    "price_normalized": 16900.0,
    "dimensions_normalized": {
      "height_mm": 600,
      "width_mm": 500,
      "depth_mm": 440
    },
    "medusa_product_handle": "co-08-1",
    "medusa_product_title": "Тумбочка прикроватная",
    "medusa_collection_handle": "country-london-paris",
    "medusa_collection_title": "Country London Paris",
    "medusa_category_handle": "tumby",
    "medusa_category_title": "Тумбы",
    "medusa_product_type": "CONFIGURABLE",
    "medusa_variant_sku": "CO-08-1",
    "medusa_price_amount": 1690000,
    "variant_strategy": "single_default",
    "asset_binding_ref": "country-london-paris:CO-08-1",
    "upload_manifest_refs": [
      "products/country-london-paris/CO-08-1_gallery_01.jpg",
      "products/country-london-paris/CO-08-1_gallery_02.jpg",
      "products/country-london-paris/CO-08-1_color_blue_01.jpg",
      "products/country-london-paris/CO-08-1_color_blue_02.jpg",
      "products/country-london-paris/CO-08-1_color_grey_01.jpg",
      "products/country-london-paris/CO-08-1_color_grey_02.jpg",
      "products/country-london-paris/CO-08-1_color_olive_01.jpg",
      "products/country-london-paris/CO-08-1_color_olive_02.jpg"
    ],
    "main_image_storage_key": "products/country-london-paris/CO-08-1_gallery_01.jpg",
    "gallery_storage_keys": [
      "products/country-london-paris/CO-08-1_gallery_02.jpg"
    ],
    "asset_quality_status": "gallery_only",
    "readiness_status": "seed_ready_with_caveat",
    "mapping_notes": "No dedicated main image, first gallery used as main",
    "excluded_reason": null,
    "blocked_reason": null,
    "needs_business_decision": false
  },
  {
    "workbook_row_key": "country-london-paris:CO-14-2",
    "product_code_normalized": "CO-14-2",
    "canonical_name": "Кровать 1 сп. (90*190) с подъем мех",
    "collection_name_normalized": "country-london-paris",
    "category_normalized": "bed",
    "price_normalized": 50100.0,
    "dimensions_normalized": {
      "height_mm": 1100,
      "width_mm": 982,
      "depth_mm": 1994
    },
    "medusa_product_handle": "co-14-2",
    "medusa_product_title": "Кровать 1 сп. (90*190) с подъем мех",
    "medusa_collection_handle": "country-london-paris",
    "medusa_collection_title": "Country London Paris",
    "medusa_category_handle": "krovati",
    "medusa_category_title": "Кровати",
    "medusa_product_type": "CONFIGURABLE",
    "medusa_variant_sku": "CO-14-2",
    "medusa_price_amount": 5010000,
    "variant_strategy": "single_default",
    "asset_binding_ref": "country-london-paris:CO-14-2",
    "upload_manifest_refs": [
      "products/country-london-paris/CO-14-2_gallery_01.jpg",
      "products/country-london-paris/CO-14-2_color_torno_01.jpg"
    ],
    "main_image_storage_key": "products/country-london-paris/CO-14-2_gallery_01.jpg",
    "gallery_storage_keys": [],
    "asset_quality_status": "gallery_only",
    "readiness_status": "seed_ready_with_caveat",
    "mapping_notes": "No dedicated main image, first gallery used as main",
    "excluded_reason": null,
    "blocked_reason": null,
    "needs_business_decision": false
  },
  {
    "workbook_row_key": "country-london-paris:CO-15-2",
    "product_code_normalized": "CO-15-2",
    "canonical_name": "Кровать 1,5 сп. (120*190) с подъем мех",
    "collection_name_normalized": "country-london-paris",
    "category_normalized": "bed",
    "price_normalized": 62000.0,
    "dimensions_normalized": {
      "height_mm": 1150,
      "width_mm": 1282,
      "depth_mm": 1990
    },
    "medusa_product_handle": "co-15-2",
    "medusa_product_title": "Кровать 1,5 сп. (120*190) с подъем мех",
    "medusa_collection_handle": "country-london-paris",
    "medusa_collection_title": "Country London Paris",
    "medusa_category_handle": "krovati",
    "medusa_category_title": "Кровати",
    "medusa_product_type": "CONFIGURABLE",
    "medusa_variant_sku": "CO-15-2",
    "medusa_price_amount": 6200000,
    "variant_strategy": "single_default",
    "asset_binding_ref": "country-london-paris:CO-15-2",
    "upload_manifest_refs": [
      "products/country-london-paris/CO-15-2_main.jpg",
      "products/country-london-paris/CO-15-2_gallery_01.jpg",
      "products/country-london-paris/CO-15-2_gallery_02.jpg",
      "products/country-london-paris/CO-15-2_gallery_03.jpg",
      "products/country-london-paris/CO-15-2_gallery_04.jpg",
      "products/country-london-paris/CO-15-2_gallery_05.jpg"
    ],
    "main_image_storage_key": "products/country-london-paris/CO-15-2_main.jpg",
    "gallery_storage_keys": [
      "products/country-london-paris/CO-15-2_gallery_01.jpg",
      "products/country-london-paris/CO-15-2_gallery_02.jpg",
      "products/country-london-paris/CO-15-2_gallery_03.jpg",
      "products/country-london-paris/CO-15-2_gallery_04.jpg",
      "products/country-london-paris/CO-15-2_gallery_05.jpg"
    ],
    "asset_quality_status": "ok",
    "readiness_status": "seed_ready",
    "mapping_notes": "",
    "excluded_reason": null,
    "blocked_reason": null,
    "needs_business_decision": false
  },
  {
    "workbook_row_key": "country-london-paris:CO-61-1",
    "product_code_normalized": "CO-61-1",
    "canonical_name": "Шкаф книжный со стеклом",
    "collection_name_normalized": "country-london-paris",
    "category_normalized": "wardrobe",
    "price_normalized": 82000.0,
    "dimensions_normalized": {
      "height_mm": 2200,
      "width_mm": 1200,
      "depth_mm": 428
    },
    "medusa_product_handle": "co-61-1",
    "medusa_product_title": "Шкаф книжный со стеклом",
    "medusa_collection_handle": "country-london-paris",
    "medusa_collection_title": "Country London Paris",
    "medusa_category_handle": "shkafy",
    "medusa_category_title": "Шкафы",
    "medusa_product_type": "CONFIGURABLE",
    "medusa_variant_sku": "CO-61-1",
    "medusa_price_amount": 8200000,
    "variant_strategy": "single_default",
    "asset_binding_ref": "country-london-paris:CO-61-1",
    "upload_manifest_refs": [